{
  "review_request_id": "CFRR-CAL-SPACE-001-FPV1",
  "project_id": "CAL-COMMERCIAL-SPACE-001",
  "content_id": "C-9001",
  "content_version": "CV-1",
  "copy_version": "CV-1",
  "visual_plan_version": "VV-1",
  "calibration_cover_version": "FPV-1",
  "asset_id": "AST-CAL-SPACE-001-FPV1",
  "asset_checksum": "bbbbbbbbbbbbbbbbbbbbbbbbbbbbbbbbbbbbbbbbbbbbbbbbbbbbbbbbbbbbbbbb",
  "gate": "CALIBRATION_G4",
  "status": "AWAITING_USER_APPROVAL",
  "decision": "PENDING_OPERATOR",
  "reviewer_role": "OPERATOR",
  "approval_event_created": false,
  "style_lock_created": false,
  "remaining_pages_created": 0,
  "feishu_writes": 0,
  "run_id": "RUN-20990101-010203-DEMO",
  "schema_version": "1.0.0",
  "created_at": "2099-01-01T01:02:03.000Z"
}
